{
    "$schema": "https://json-schema.org/draft/2020-12/schema",
    "$id": "/schemas/data/guidance.schema.json",
    "title": "Guidance Schema",
    "description": "Schema for validating guidance objects used in data.scilifelab.se.",
    "type": "array",
    "items": {
      "type": "object",
      "required": [
        "type",
        "search_tags",
        "name",
        "description",
        "url",
        "thumbnail",
        "created_by",
        "created_by_url",
        "support_email"
      ],
      "properties": {
        "type": {
          "type": "array",
          "items": {
            "type": "string",
            "minLength": 1
          },
          "minItems": 1,
          "uniqueItems": true,
          "description": "One or more categories describing the type of guidance."
        },
        "search_tags": {
          "type": "array",
          "items": {
            "type": "string",
            "minLength": 1
          },
          "minItems": 1,
          "uniqueItems": true,
          "description": "Search keywords associated with the guidance."
        },
        "name": {
          "type": "string",
          "minLength": 1,
          "description": "Title or name of the guidance."
        },
        "description": {
          "type": "string",
          "minLength": 1,
          "description": "Short description explaining the guidance purpose or content."
        },
        "url": {
          "type": "string",
          "description": "URL linking to the guidance.",
          "pattern": "^(https?:\\/\\/|\\/).+"
        },
        "thumbnail": {
          "type": "string",
          "description": "Path to a thumbnail image for the guidance.",
          "pattern": "^\\/img\\/guidance_thumbnails\\/[^\\s]+\\.(jpg|jpeg|png|svg)$"
        },
        "thumbnail_border": {
          "type": "boolean",
          "description": "OPTIONAL: Whether to display a border around the thumbnail image.",
          "default": false
        },
        "created_by": {
          "type": "string",
          "minLength": 1,
          "description": "Name of the individual or group that created the guidance."
        },
        "created_by_url": {
          "type": "string",
          "format": "uri",
          "description": "Web address of the creating organization or individual."
        },
        "support_email": {
          "type": "string",
          "format": "email",
          "description": "Email address to contact for support regarding the guidance."
        }
      },
      "additionalProperties": false
    }
  }
