[
  {
    "type": ["Interactive guide"],
    "search_tags": [
      "Data driven lifecycle",
      "DDLS",
      "SciLifeLab",
      "Data Centre",
      "Guide"
    ],
    "name": "The Data-driven life cycle",
    "description": "Learn more about the Data lifecycle and find out which services are offered by the Data Centre and NBIS in this interactive guide.",
    "url": "https://www.scilifelab.se/data-driven/ddls-data-lifecycle/",
    "thumbnail": "/img/resource_thumbnails/ddls_lifecycle.jpg",
    "created_by": "SciLifeLab Comms/Ceros",
    "created_by_url": "https://scilifelab.se/",
    "support_email": "johan.inganni@scilifelab.se"
  },
  {
    "type": ["Research Data Management"],
    "search_tags": [
      "RDM",
      "Research data management",
      "Guidelines",
      "Helpdesk",
      "Portal",
      "NBIS",
      "SciLifeLab",
      "SciLifeLab Data Centre",
      "Data Centre",
      "SciLifeLab RDM Guidelines"
    ],
    "name": "SciLifeLab RDM guidelines",
    "description": "A knowledge hub containing guidance to life science researchers in Sweden regarding Research Data Management (RDM)",
    "url": "https://data-guidelines.scilifelab.se",
    "thumbnail": "/img/service_thumbnails/rdm.jpg",
    "created_by": "NBIS, SciLifeLab Data Centre",
    "created_by_url": "https://data-guidelines.scilifelab.se/contact/",
    "support_email": "data-management@scilifelab.se",
    "thumbnail_border": true
  },
  {
    "type": ["Data sources"],
    "search_tags": [
      "sources",
      "data",
      "repositories",
      "download",
      "submit",
      "submission"
    ],
    "name": "Data sources",
    "description": "Sources of data that can potentially be used by researchers in Sweden. The list includes places where data and be accessed and/or submitted.",
    "url": "/resources/data_sources",
    "thumbnail": "/img/resource_thumbnails/data_sources.jpg",
    "created_by": "SciLifeLab Data Centre",
    "created_by_url": "https://scilifelab.se/data",
    "support_email": "datacentre@scilifelab.se"
  },
  {
    "type": ["Compute resources"],
    "search_tags": [
      "Compute resource",
      "E-infrastructure",
      "Compute hosting",
      "SciLifeLab",
      "Data Centre",
      "Hosting"
    ],
    "name": "Compute resources in Sweden",
    "description": "Information about the compute resources (primarily for hosting and analysis) available in Sweden, as well as how to apply.",
    "url": "/resources/e-infrastructure/",
    "thumbnail": "/img/resource_thumbnails/compute.jpg",
    "created_by": "SciLifeLab Data Centre",
    "created_by_url": "https://scilifelab.se/data",
    "support_email": "datacentre@scilifelab.se"
  },
  {
    "type": ["Storage resources"],
    "search_tags": ["Storage resource", "SciLifeLab", "Data Centre"],
    "name": "Storage resources in Sweden",
    "description": "Information about the storage resources available in Sweden for researchers, as well as how to apply.",
    "url": "/resources/storage/",
    "thumbnail": "/img/resource_thumbnails/storage.jpg",
    "created_by": "SciLifeLab Data Centre",
    "created_by_url": "https://scilifelab.se/data",
    "support_email": "datacentre@scilifelab.se"
  },
  {
    "type": ["Alternative metrics"],
    "search_tags": [
      "impact",
      "research impact",
      "bibliometrics",
      "impact assessment",
      "Altmetrics",
      "plumx",
      "impactstory",
      "Alternative metrics",
      "SciLifeLab",
      "Data Centre"
    ],
    "name": "Alternative metrics for impact",
    "description": "Information about alternative metrics, including what they are, their importance to your research, and how to maximise your scores.",
    "url": "/resources/altmetrics",
    "thumbnail": "/img/resource_thumbnails/plumx_cloud.png",
    "thumbnail_border": true,
    "created_by": "SciLifeLab Data Centre",
    "created_by_url": "https://scilifelab.se/data",
    "support_email": "datacentre@scilifelab.se"
  }
]
